<?xml version="1.0" encoding="UTF-8"?>
<nn xmlns="nju.chuan.nn"
    xmlns:xsi="http://www.w3.org/2001/XMLSchema-instance" xsi:schemaLocation="nju.chuan.nn ./nn.xsd">
    <hp>
        <nEpoch>800</nEpoch>
        <bs>64</bs>
        <lr>0.00005</lr>
        <nLatent>64</nLatent>
        <iterD>1</iterD>
        <iterG>1</iterG>
        <clip>0.01</clip>
    </hp>
    <nnLayer>
        <!-- ndf=16 -->
        <!-- ngf=16 -->

        <!-- Discriminator -->
        <!-- 1 * 64 * 64 * 64 -->
        <conv dim="3d" id="1">
            <in_channels>1</in_channels>
            <out_channels>16</out_channels>
            <kernel_size>4</kernel_size>
            <stride>2</stride>
            <padding>1</padding>
            <bias>false</bias>
            <normalize>null</normalize>
            <activate param="0.2">leakyrelu</activate>
        </conv>

        <!-- ndf * 32 * 32 * 32 -->
        <conv dim="3d" id="2">
            <in_channels>16</in_channels>
            <out_channels>32</out_channels>
            <kernel_size>4</kernel_size>
            <stride>2</stride>
            <padding>1</padding>
            <bias>false</bias>
            <normalize>bn</normalize>
            <activate param="0.2">leakyrelu</activate>
        </conv>

        <!-- (ndf * 2) * 16 * 16 * 16 -->
        <conv dim="3d" id="3">
            <in_channels>32</in_channels>
            <out_channels>64</out_channels>
            <kernel_size>4</kernel_size>
            <stride>2</stride>
            <padding>1</padding>
            <bias>false</bias>
            <normalize>bn</normalize>
            <activate param="0.2">leakyrelu</activate>
        </conv>

        <!-- (ndf * 4) * 8 * 8 * 8 -->
        <conv dim="3d" id="4">
            <in_channels>64</in_channels>
            <out_channels>128</out_channels>
            <kernel_size>4</kernel_size>
            <stride>2</stride>
            <padding>1</padding>
            <bias>false</bias>
            <normalize>bn</normalize>
            <activate param="0.2">leakyrelu</activate>
        </conv>

        <!-- (ndf * 8) * 4 * 4 * 4 -->
        <conv dim="3d" id="5">
            <in_channels>128</in_channels>
            <out_channels>1</out_channels>
            <kernel_size>4</kernel_size>
            <stride>1</stride>
            <padding>0</padding>
            <bias>false</bias>
            <normalize>null</normalize>
            <activate>null</activate>
        </conv>
        <!-- 1 * 1 * 1 * 1 -->


        <!-- Generator -->
        <!-- nLatent * 1 * 1 * 1 -->
        <convT dim="3d" id="1">
            <in_channels>64</in_channels>
            <out_channels>128</out_channels>
            <kernel_size>4</kernel_size>
            <stride>1</stride>
            <padding>0</padding>
            <output_padding>0</output_padding>
            <bias>false</bias>
            <normalize>bn</normalize>
            <activate>relu</activate>
        </convT>

        <!-- (ngf * 8) * 4 * 4 * 4 -->
        <convT dim="3d" id="2">
            <in_channels>128</in_channels>
            <out_channels>64</out_channels>
            <kernel_size>4</kernel_size>
            <stride>2</stride>
            <padding>1</padding>
            <output_padding>0</output_padding>
            <bias>false</bias>
            <normalize>bn</normalize>
            <activate>relu</activate>
        </convT>

        <!-- (ngf * 4) * 8 * 8 * 8 -->
        <convT dim="3d" id="3">
            <in_channels>64</in_channels>
            <out_channels>32</out_channels>
            <kernel_size>4</kernel_size>
            <stride>2</stride>
            <padding>1</padding>
            <output_padding>0</output_padding>
            <bias>false</bias>
            <normalize>bn</normalize>
            <activate>relu</activate>
        </convT>

        <!-- (ngf * 2) * 16 * 16 * 16 -->
        <convT dim="3d" id="4">
            <in_channels>32</in_channels>
            <out_channels>16</out_channels>
            <kernel_size>4</kernel_size>
            <stride>2</stride>
            <padding>1</padding>
            <output_padding>0</output_padding>
            <bias>false</bias>
            <normalize>bn</normalize>
            <activate>relu</activate>
        </convT>

        <!-- ngf * 32 * 32 * 32 -->
        <convT dim="3d" id="5">
            <in_channels>16</in_channels>
            <out_channels>1</out_channels>
            <kernel_size>4</kernel_size>
            <stride>2</stride>
            <padding>1</padding>
            <output_padding>0</output_padding>
            <bias>false</bias>
            <normalize>null</normalize>
            <activate>tanh</activate>
        </convT>

        <!-- 1 * 64 * 64 * 64 -->
    </nnLayer>
</nn>
