<?xml version="1.0" encoding="UTF-8"?>
<nn xmlns="nju.chuan.nn"
    xmlns:xsi="http://www.w3.org/2001/XMLSchema-instance" xsi:schemaLocation="nju.chuan.nn ./nn.xsd">
    <hp>
        <nEpoch>60</nEpoch>
        <bs>128</bs>
        <lr>0.001</lr>
    </hp>
    <nnLayer>
        <!-- 64 * 64 -->
        <conv dim="2d" id="1">
            <in_channels>3</in_channels>
            <out_channels>8</out_channels>
            <kernel_size>4</kernel_size>
            <stride>2</stride>
            <padding>1</padding>
            <bias>false</bias>
            <normalize>bn</normalize>
            <activate>relu</activate>
        </conv>
        <!-- 32 * 32 -->
        <conv dim="2d" id="2">
            <in_channels>8</in_channels>
            <out_channels>16</out_channels>
            <kernel_size>4</kernel_size>
            <stride>2</stride>
            <padding>1</padding>
            <bias>false</bias>
            <normalize>bn</normalize>
            <activate>relu</activate>
        </conv>
        <!-- 16 * 16 -->
        <conv dim="2d" id="3">
            <in_channels>16</in_channels>
            <out_channels>32</out_channels>
            <kernel_size>4</kernel_size>
            <stride>2</stride>
            <padding>1</padding>
            <bias>false</bias>
            <normalize>bn</normalize>
            <activate>relu</activate>
        </conv>
        <!-- 8 * 8 -->
        <conv dim="2d" id="4">
            <in_channels>32</in_channels>
            <out_channels>64</out_channels>
            <kernel_size>4</kernel_size>
            <stride>2</stride>
            <padding>1</padding>
            <bias>false</bias>
            <normalize>bn</normalize>
            <activate>relu</activate>
        </conv>
        <!-- 4 * 4 -->
        <fc dim="1d" id="1">
            <in_features>1024</in_features>
            <out_features>256</out_features>
            <bias>false</bias>
            <normalize>bn</normalize>
            <activate>relu</activate>
        </fc>

        <convT dim="3d" id="1">
            <in_channels>256</in_channels>
            <out_channels>128</out_channels>
            <kernel_size>4</kernel_size>
            <stride>1</stride>
            <padding>0</padding>
            <output_padding>0</output_padding>
            <bias>false</bias>
            <normalize>bn</normalize>
            <activate>relu</activate>
        </convT>

        <convT dim="3d" id="2">
            <in_channels>128</in_channels>
            <out_channels>64</out_channels>
            <kernel_size>4</kernel_size>
            <stride>2</stride>
            <padding>1</padding>
            <output_padding>0</output_padding>
            <bias>false</bias>
            <normalize>bn</normalize>
            <activate>relu</activate>
        </convT>

        <convT dim="3d" id="3">
            <in_channels>64</in_channels>
            <out_channels>32</out_channels>
            <kernel_size>4</kernel_size>
            <stride>2</stride>
            <padding>1</padding>
            <output_padding>0</output_padding>
            <bias>false</bias>
            <normalize>bn</normalize>
            <activate>relu</activate>
        </convT>

        <convT dim="3d" id="4">
            <in_channels>32</in_channels>
            <out_channels>16</out_channels>
            <kernel_size>4</kernel_size>
            <stride>2</stride>
            <padding>1</padding>
            <output_padding>0</output_padding>
            <bias>false</bias>
            <normalize>bn</normalize>
            <activate>relu</activate>
        </convT>

        <convT dim="3d" id="5">
            <in_channels>16</in_channels>
            <out_channels>1</out_channels>
            <kernel_size>4</kernel_size>
            <stride>2</stride>
            <padding>1</padding>
            <output_padding>0</output_padding>
            <bias>false</bias>
            <normalize>null</normalize>
            <activate>sigmoid</activate>
        </convT>
    </nnLayer>
</nn>